{
  "$schema": "http://json-schema.org/draft-07/schema#",
  "definitions": {
    "RecipeIdentityView": {
      "description": "The recipe-identity triple surfaced on a model record — the answer to \"what exact program, over what inputs, in what environment produced this?\".\n\nRead back from the persisted [`rocky_core::state::ModelExecution`]. Every field is optional: a record written before the triple was captured (state schema predating it) or a failed execution carries none of them, and the input side is absent on the default run path (which observes no inputs). The whole object is omitted from JSON when nothing was recorded — see [`Self::from_execution`] — so output for pre-triple records is unchanged.",
      "properties": {
        "env_hash": {
          "description": "The **environment** key: blake3 (hex) over the engine version and the adapter / dialect identity. Excludes the hostname by construction.",
          "type": [
            "string",
            "null"
          ]
        },
        "hash_scheme": {
          "description": "The hash-scheme tag (`\"v1\"`) in force when the triple was computed, so a future canonicalisation change is an explicit new scheme rather than a silent history fork.",
          "type": [
            "string",
            "null"
          ]
        },
        "input_hash": {
          "description": "The **input** key: blake3 (hex) over the run's observed input identities. Present only when the run actually observed inputs (the `--skip-unchanged` gate's upstream freshness signatures, or the content-addressed reuse spine); absent on the default run path.",
          "type": [
            "string",
            "null"
          ]
        },
        "input_proof_class": {
          "description": "Strength of [`Self::input_hash`]: `\"strong\"` (every observed upstream is a content hash — offline byte-verifiable) or `\"heuristic\"` (at least one is a freshness signature, attesting freshness rather than byte-identity). Carried so a weak input hash is never presented as a content claim. `None` whenever [`Self::input_hash`] is `None`.",
          "type": [
            "string",
            "null"
          ]
        },
        "recipe_hash": {
          "description": "The program **identity** key: blake3 (hex) of the canonical `ModelIr` JSON. Stable across environments and engine versions for the same program text. The value `rocky history --recipe <hash>` filters on.",
          "type": [
            "string",
            "null"
          ]
        }
      },
      "type": "object"
    },
    "RunHistoryRecord": {
      "description": "One run from the state store, mirroring `rocky_core::state::RunRecord` with serializable field types (no enums or non-JSON-friendly Rust types).\n\nThe governance audit fields (`triggering_identity`, `session_source`, `git_commit`, `git_branch`, `idempotency_key`, `target_catalog`, `hostname`, `rocky_version`) are only populated in the `rocky history --audit` shape; the default shape continues to emit just the existing 7 fields. The `#[serde(skip_serializing_if = \"…\")]` attributes keep the default payload byte-identical to schema v5 unless `--audit` flips the fields on.",
      "properties": {
        "duration_ms": {
          "description": "Duration in milliseconds (`finished_at - started_at`).",
          "format": "uint64",
          "minimum": 0.0,
          "type": "integer"
        },
        "git_branch": {
          "description": "`git symbolic-ref --short HEAD` at claim time, or `None` on detached HEAD.",
          "type": [
            "string",
            "null"
          ]
        },
        "git_commit": {
          "description": "`git rev-parse HEAD` at claim time.",
          "type": [
            "string",
            "null"
          ]
        },
        "hostname": {
          "description": "Machine hostname that produced the run.",
          "type": [
            "string",
            "null"
          ]
        },
        "idempotency_key": {
          "description": "The `--idempotency-key` value supplied to `rocky run`, if any.",
          "type": [
            "string",
            "null"
          ]
        },
        "models": {
          "description": "Per-model execution details for this run.",
          "items": {
            "$ref": "#/definitions/RunModelRecord"
          },
          "type": "array"
        },
        "models_executed": {
          "format": "uint",
          "minimum": 0.0,
          "type": "integer"
        },
        "pipeline": {
          "description": "The pipeline this run executed (`rocky run --pipeline <name>`), when recorded. `None` for model-only or backfill runs. Not audit-gated — it is an operational join key, always emitted when present.",
          "type": [
            "string",
            "null"
          ]
        },
        "rocky_branch": {
          "description": "The named Rocky branch this run wrote to (`rocky run --branch <name>`), or `None` for a production / plain-`--shadow` run. Distinct from `git_branch` — see `RunRecord::rocky_branch` (#2032). Not audit-gated — like [`Self::pipeline`], it is an operational join key (`rocky preview diff`/`preview cost` pair a run by this field), always emitted when present.",
          "type": [
            "string",
            "null"
          ]
        },
        "rocky_version": {
          "description": "`CARGO_PKG_VERSION` of the `rocky` binary, or `\"<pre-audit>\"` on schema-v5 rows that predate the audit trail.",
          "type": [
            "string",
            "null"
          ]
        },
        "run_id": {
          "type": "string"
        },
        "session_source": {
          "description": "Session origin — `\"cli\"`, `\"dagster\"`, `\"lsp\"`, or `\"http_api\"`. Emitted as the lowercase variant string so JSON consumers can match on it without knowing the Rust enum shape.",
          "type": [
            "string",
            "null"
          ]
        },
        "started_at": {
          "format": "date-time",
          "type": "string"
        },
        "status": {
          "type": "string"
        },
        "submission_id": {
          "description": "The scheduler submission id — `rocky tick` stamps it via `ROCKY_SUBMISSION_ID`, so this is the join key to a tick's `TickOutput.executed[].submission_id`. `None` for manually launched runs.",
          "type": [
            "string",
            "null"
          ]
        },
        "target_catalog": {
          "description": "Best-available target catalog — the `catalog_template` for replication pipelines, the literal `target.catalog` for transformation/quality/snapshot/load.",
          "type": [
            "string",
            "null"
          ]
        },
        "trigger": {
          "type": "string"
        },
        "triggering_identity": {
          "description": "Resolved caller identity (Unix `$USER` / Windows `$USERNAME`). `None` in CI / container contexts where no human caller is discernible.",
          "type": [
            "string",
            "null"
          ]
        }
      },
      "required": [
        "duration_ms",
        "models",
        "models_executed",
        "run_id",
        "started_at",
        "status",
        "trigger"
      ],
      "type": "object"
    },
    "RunModelRecord": {
      "description": "Per-model execution record embedded in [`RunHistoryRecord`].",
      "properties": {
        "duration_ms": {
          "format": "uint64",
          "minimum": 0.0,
          "type": "integer"
        },
        "model_name": {
          "type": "string"
        },
        "recipe_identity": {
          "anyOf": [
            {
              "$ref": "#/definitions/RecipeIdentityView"
            },
            {
              "type": "null"
            }
          ],
          "description": "The recipe-identity triple recorded for this execution, when present. See [`RecipeIdentityView`]."
        },
        "rows_affected": {
          "format": "uint64",
          "minimum": 0.0,
          "type": [
            "integer",
            "null"
          ]
        },
        "status": {
          "type": "string"
        }
      },
      "required": [
        "duration_ms",
        "model_name",
        "status"
      ],
      "type": "object"
    },
    "UnrecordedRunEvidence": {
      "description": "What left an [`UnrecordedRunRecord`] in the ledger (#1884).",
      "oneOf": [
        {
          "description": "A replication run's resume checkpoint header.",
          "enum": [
            "checkpoint"
          ],
          "type": "string"
        },
        {
          "description": "A non-replication run's start marker (transformation, quality, snapshot, model-only, backfill).",
          "enum": [
            "run_started"
          ],
          "type": "string"
        }
      ]
    },
    "UnrecordedRunRecord": {
      "description": "A run whose start is in the ledger but whose run record is not (#1884). See [`HistoryOutput::unrecorded_runs`].",
      "properties": {
        "evidence": {
          "allOf": [
            {
              "$ref": "#/definitions/UnrecordedRunEvidence"
            }
          ],
          "description": "The ledger evidence the run left: a replication `checkpoint` header or, for every other run kind, a `run_started` marker."
        },
        "pipeline": {
          "description": "The pipeline the run was building, when recorded.",
          "type": [
            "string",
            "null"
          ]
        },
        "run_id": {
          "type": "string"
        },
        "started_at": {
          "format": "date-time",
          "type": "string"
        },
        "superseded": {
          "description": "`true` when a later recorded run of the same tables retired this checkpoint for resume. The record is still missing. Always `false` for a `run_started` marker.",
          "type": "boolean"
        },
        "total_tables": {
          "description": "Tables the run planned to copy. Set for checkpoint evidence only.",
          "format": "uint",
          "minimum": 0.0,
          "type": [
            "integer",
            "null"
          ]
        }
      },
      "required": [
        "evidence",
        "run_id",
        "started_at",
        "superseded"
      ],
      "type": "object"
    }
  },
  "description": "JSON output for `rocky history` (all runs view).\n\nWhen invoked with `--model <name>`, the dispatch returns `ModelHistoryOutput` instead. The two shapes share the version/command header but differ in their primary collection field, which is why they are separate types rather than one enum.",
  "properties": {
    "command": {
      "type": "string"
    },
    "count": {
      "format": "uint",
      "minimum": 0.0,
      "type": "integer"
    },
    "runs": {
      "items": {
        "$ref": "#/definitions/RunHistoryRecord"
      },
      "type": "array"
    },
    "unrecorded_runs": {
      "description": "Runs that started — a replication run's checkpoint header or another run kind's start marker is in the ledger — but have NO run record: still running, crashed, or the record write failed (#1884). Their presence means `runs` is not the complete history. Not counted in `count`. Omitted when empty.",
      "items": {
        "$ref": "#/definitions/UnrecordedRunRecord"
      },
      "type": "array"
    },
    "version": {
      "type": "string"
    }
  },
  "required": [
    "command",
    "count",
    "runs",
    "version"
  ],
  "title": "HistoryOutput",
  "type": "object"
}
