{
  "version": "0.0.0-SENTINEL",
  "command": "history",
  "runs": [
    {
      "run_id": "run-SENTINEL",
      "started_at": "2000-01-01T00:00:00Z",
      "status": "Success",
      "trigger": "Manual",
      "models_executed": 1,
      "duration_ms": 0,
      "models": [
        {
          "model_name": "orders",
          "duration_ms": 0,
          "status": "success",
          "recipe_identity": {
            "recipe_hash": "d865beb2232b3960e696688b18df6a65fbd0a0eee523c13fbce3b398346ba30e",
            "env_hash": "envhash-SENTINEL",
            "hash_scheme": "v1"
          }
        }
      ],
      "pipeline": "playground",
      "run_scope": "production"
    },
    {
      "run_id": "run-SENTINEL",
      "started_at": "2000-01-01T00:00:00Z",
      "status": "Success",
      "trigger": "Manual",
      "models_executed": 1,
      "duration_ms": 0,
      "models": [
        {
          "model_name": "orders",
          "duration_ms": 0,
          "status": "success",
          "recipe_identity": {
            "recipe_hash": "d865beb2232b3960e696688b18df6a65fbd0a0eee523c13fbce3b398346ba30e",
            "env_hash": "envhash-SENTINEL",
            "hash_scheme": "v1"
          }
        }
      ],
      "pipeline": "playground",
      "run_scope": "production"
    }
  ],
  "count": 2
}
