{
  "version": "0.0.0-SENTINEL",
  "command": "history",
  "runs": [
    {
      "run_id": "run-SENTINEL",
      "started_at": "2000-01-01T00:00:00Z",
      "status": "Success",
      "trigger": "Manual",
      "models_executed": 1,
      "duration_ms": 0,
      "models": [
        {
          "model_name": "events",
          "duration_ms": 0,
          "status": "success",
          "recipe_identity": {
            "recipe_hash": "b9522177d343c0197691396194137ffde6e7a73676a6b386d16ef9a75519a4f1",
            "env_hash": "envhash-SENTINEL",
            "hash_scheme": "v1"
          }
        }
      ],
      "pipeline": "poc",
      "run_scope": "production"
    },
    {
      "run_id": "run-SENTINEL",
      "started_at": "2000-01-01T00:00:00Z",
      "status": "Success",
      "trigger": "Manual",
      "models_executed": 1,
      "duration_ms": 0,
      "models": [
        {
          "model_name": "events",
          "duration_ms": 0,
          "status": "success",
          "recipe_identity": {
            "recipe_hash": "b9522177d343c0197691396194137ffde6e7a73676a6b386d16ef9a75519a4f1",
            "env_hash": "envhash-SENTINEL",
            "hash_scheme": "v1"
          }
        }
      ],
      "pipeline": "poc",
      "run_scope": "production"
    },
    {
      "run_id": "run-SENTINEL",
      "started_at": "2000-01-01T00:00:00Z",
      "status": "Success",
      "trigger": "Manual",
      "models_executed": 1,
      "duration_ms": 0,
      "models": [
        {
          "model_name": "events",
          "duration_ms": 0,
          "status": "success",
          "recipe_identity": {
            "recipe_hash": "b9522177d343c0197691396194137ffde6e7a73676a6b386d16ef9a75519a4f1",
            "env_hash": "envhash-SENTINEL",
            "hash_scheme": "v1"
          }
        }
      ],
      "pipeline": "poc",
      "run_scope": "production"
    },
    {
      "run_id": "run-SENTINEL",
      "started_at": "2000-01-01T00:00:00Z",
      "status": "Success",
      "trigger": "Manual",
      "models_executed": 1,
      "duration_ms": 0,
      "models": [
        {
          "model_name": "events",
          "duration_ms": 0,
          "status": "success",
          "recipe_identity": {
            "recipe_hash": "b9522177d343c0197691396194137ffde6e7a73676a6b386d16ef9a75519a4f1",
            "env_hash": "envhash-SENTINEL",
            "hash_scheme": "v1"
          }
        }
      ],
      "pipeline": "poc",
      "run_scope": "production"
    }
  ],
  "count": 4
}
